Sheet: J
B1: Shared Expenses (R.I.E.G.) | F1: Split Expenses | H1: POST TAX EARNINGS
B2: RENT | C2: INTERNET | D2: ELECTRIC | E2: GROCERY | F2: HOME
A3: BASE | B3: 1550 | C3: 30 | D3: 80 | E3: 150 | F3: 200
I4: JONATHAN | K4: GRACE
A5: EVERY 2 WEEKS | B5: of:=[.B3]/2 -> 775 | C5: of:=[.C3]/2 -> 15 | D5: 60 | E5: of:=([.E3]*2) -> 300 | F5: of:=[.F3]/2 -> 100
H6: BI WEEKLY PAY | I6: 2207 | K6: of:=777*2 -> 1554
A7: Total Shared Expenses | B7: of:=SUM([.B5:.E5]) -> 1150 | J7: SUM
J8: of:=[.I6]+[.K6] -> 3761
A9: Total Split Expenses | B9: of:=[.F5] -> 100
H10: % of total income going to R, I, E, G | J10: of:=([.B7]/[.J8]) -> 0.30576974208987
A11: Total Biweekly Expenses | B11: of:=[.B7]+[.B9] -> 1250
H13: Amount each person pays for R, I, E, G | I13: of:=([.J10]*[.I6]) -> 674.833820792343 | K13: of:=([.J10]*[.K6]) -> 475.166179207658
I14: SUM
I15: of:=([.I13]+[.K13]) -> 1150
A17: BILLS DUE | H17: Split Expenses | I17: of:=[.B9]/2 -> 50 | K17: of:=[.B9]/2 -> 50
A18: ELECTRICITY | B18: 20th
A19: INTERNET | B19: 21st
A20: RENT | B20: 3rd
H21: Total to add to join account biweekly | I21: of:=ROUNDUP([.I13]+[.I17]) -> 725 | K21: of:=ROUNDDOWN([.K17]+[.K13]) -> 525
I22: SUM
I23: of:=([.I21]+[.K21]) -> 1250